
*** Running vivado
    with args -log design_1_wrapper.vdi -applog -m64 -product Vivado -messageDb vivado.pb -mode batch -source design_1_wrapper.tcl -notrace


****** Vivado v2025.1 (64-bit)
  **** SW Build 6140274 on Wed May 21 22:58:25 MDT 2025
  **** IP Build 6138677 on Thu May 22 03:10:11 MDT 2025
  **** SharedData Build 6139179 on Tue May 20 17:58:58 MDT 2025
  **** Start of session at: Wed Jan 28 14:45:15 2026
    ** Copyright 1986-2022 Xilinx, Inc. All Rights Reserved.
    ** Copyright 2022-2025 Advanced Micro Devices, Inc. All Rights Reserved.

source design_1_wrapper.tcl -notrace
INFO: [IP_Flow 19-234] Refreshing IP repositories
INFO: [IP_Flow 19-1700] Loaded user IP repository '/home/rickg/Desktop/AXISearch/ip_repo/my_pwm_ip_1_0'.
INFO: [IP_Flow 19-2313] Loaded Vivado IP repository '/tools/Xilinx/2025.1/Vivado/data/ip'.
Command: link_design -top design_1_wrapper -part xc7z020clg400-1
Design is defaulting to srcset: sources_1
Design is defaulting to constrset: constrs_1
INFO: [Device 21-403] Loading part xc7z020clg400-1
INFO: [Project 1-5699] Read binary netlist with skipMacroContent - 1
INFO: [Project 1-454] Reading design checkpoint '/home/rickg/Desktop/AXISearch/pwm_ip_demo/pwm_ip_demo.gen/sources_1/bd/design_1/ip/design_1_axi_smc_0/design_1_axi_smc_0.dcp' for cell 'design_1_i/axi_smc'
INFO: [Project 1-454] Reading design checkpoint '/home/rickg/Desktop/AXISearch/pwm_ip_demo/pwm_ip_demo.gen/sources_1/bd/design_1/ip/design_1_clk_wiz_1_0/design_1_clk_wiz_1_0.dcp' for cell 'design_1_i/clk_wiz_1'
INFO: [Project 1-454] Reading design checkpoint '/home/rickg/Desktop/AXISearch/pwm_ip_demo/pwm_ip_demo.gen/sources_1/bd/design_1/ip/design_1_mdm_1_0/design_1_mdm_1_0.dcp' for cell 'design_1_i/mdm_1'
INFO: [Project 1-454] Reading design checkpoint '/home/rickg/Desktop/AXISearch/pwm_ip_demo/pwm_ip_demo.gen/sources_1/bd/design_1/ip/design_1_microblaze_0_1/design_1_microblaze_0_1.dcp' for cell 'design_1_i/microblaze_0'
INFO: [Project 1-454] Reading design checkpoint '/home/rickg/Desktop/AXISearch/pwm_ip_demo/pwm_ip_demo.gen/sources_1/bd/design_1/ip/design_1_my_pwm_ip_0_1/design_1_my_pwm_ip_0_1.dcp' for cell 'design_1_i/my_pwm_ip_0'
INFO: [Project 1-454] Reading design checkpoint '/home/rickg/Desktop/AXISearch/pwm_ip_demo/pwm_ip_demo.gen/sources_1/bd/design_1/ip/design_1_rst_clk_wiz_1_100M_0/design_1_rst_clk_wiz_1_100M_0.dcp' for cell 'design_1_i/rst_clk_wiz_1_100M'
INFO: [Project 1-454] Reading design checkpoint '/home/rickg/Desktop/AXISearch/pwm_ip_demo/pwm_ip_demo.gen/sources_1/bd/design_1/ip/design_1_dlmb_bram_if_cntlr_0/design_1_dlmb_bram_if_cntlr_0.dcp' for cell 'design_1_i/microblaze_0_local_memory/dlmb_bram_if_cntlr'
INFO: [Project 1-454] Reading design checkpoint '/home/rickg/Desktop/AXISearch/pwm_ip_demo/pwm_ip_demo.gen/sources_1/bd/design_1/ip/design_1_dlmb_v10_0/design_1_dlmb_v10_0.dcp' for cell 'design_1_i/microblaze_0_local_memory/dlmb_v10'
INFO: [Project 1-454] Reading design checkpoint '/home/rickg/Desktop/AXISearch/pwm_ip_demo/pwm_ip_demo.gen/sources_1/bd/design_1/ip/design_1_ilmb_bram_if_cntlr_0/design_1_ilmb_bram_if_cntlr_0.dcp' for cell 'design_1_i/microblaze_0_local_memory/ilmb_bram_if_cntlr'
INFO: [Project 1-454] Reading design checkpoint '/home/rickg/Desktop/AXISearch/pwm_ip_demo/pwm_ip_demo.gen/sources_1/bd/design_1/ip/design_1_ilmb_v10_0/design_1_ilmb_v10_0.dcp' for cell 'design_1_i/microblaze_0_local_memory/ilmb_v10'
INFO: [Project 1-454] Reading design checkpoint '/home/rickg/Desktop/AXISearch/pwm_ip_demo/pwm_ip_demo.gen/sources_1/bd/design_1/ip/design_1_lmb_bram_0/design_1_lmb_bram_0.dcp' for cell 'design_1_i/microblaze_0_local_memory/lmb_bram'
Netlist sorting complete. Time (s): cpu = 00:00:00.07 ; elapsed = 00:00:00.07 . Memory (MB): peak = 1789.324 ; gain = 0.000 ; free physical = 5798 ; free virtual = 8581
INFO: [Netlist 29-17] Analyzing 263 Unisim elements for replacement
INFO: [Netlist 29-28] Unisim Transformation completed in 0 CPU seconds
INFO: [Project 1-479] Netlist was created with Vivado 2025.1
INFO: [Project 1-570] Preparing netlist for logic optimization
Parsing XDC File [/home/rickg/Desktop/AXISearch/pwm_ip_demo/pwm_ip_demo.gen/sources_1/bd/design_1/ip/design_1_microblaze_0_1/design_1_microblaze_0_1.xdc] for cell 'design_1_i/microblaze_0/U0'
WARNING: [Vivado_Tcl 4-921] Waiver ID 'CDC-26' -to list should not be empty. [/home/rickg/Desktop/AXISearch/pwm_ip_demo/pwm_ip_demo.gen/sources_1/bd/design_1/ip/design_1_microblaze_0_1/design_1_microblaze_0_1.xdc:2]
WARNING: [Vivado_Tcl 4-921] Waiver ID 'CDC-26' -to list should not be empty. [/home/rickg/Desktop/AXISearch/pwm_ip_demo/pwm_ip_demo.gen/sources_1/bd/design_1/ip/design_1_microblaze_0_1/design_1_microblaze_0_1.xdc:4]
WARNING: [Vivado_Tcl 4-921] Waiver ID 'CDC-1' -to list should not be empty. [/home/rickg/Desktop/AXISearch/pwm_ip_demo/pwm_ip_demo.gen/sources_1/bd/design_1/ip/design_1_microblaze_0_1/design_1_microblaze_0_1.xdc:26]
WARNING: [Vivado_Tcl 4-921] Waiver ID 'CDC-1' -to list should not be empty. [/home/rickg/Desktop/AXISearch/pwm_ip_demo/pwm_ip_demo.gen/sources_1/bd/design_1/ip/design_1_microblaze_0_1/design_1_microblaze_0_1.xdc:36]
WARNING: [Vivado_Tcl 4-921] Waiver ID 'CDC-1' -to list should not be empty. [/home/rickg/Desktop/AXISearch/pwm_ip_demo/pwm_ip_demo.gen/sources_1/bd/design_1/ip/design_1_microblaze_0_1/design_1_microblaze_0_1.xdc:60]
WARNING: [Vivado_Tcl 4-921] Waiver ID 'CDC-1' -to list should not be empty. [/home/rickg/Desktop/AXISearch/pwm_ip_demo/pwm_ip_demo.gen/sources_1/bd/design_1/ip/design_1_microblaze_0_1/design_1_microblaze_0_1.xdc:68]
WARNING: [Vivado_Tcl 4-921] Waiver ID 'CDC-1' -to list should not be empty. [/home/rickg/Desktop/AXISearch/pwm_ip_demo/pwm_ip_demo.gen/sources_1/bd/design_1/ip/design_1_microblaze_0_1/design_1_microblaze_0_1.xdc:76]
WARNING: [Vivado_Tcl 4-921] Waiver ID 'CDC-7' -to list should not be empty. [/home/rickg/Desktop/AXISearch/pwm_ip_demo/pwm_ip_demo.gen/sources_1/bd/design_1/ip/design_1_microblaze_0_1/design_1_microblaze_0_1.xdc:94]
WARNING: [Vivado_Tcl 4-919] Waiver ID 'CDC-11' -from list should not be empty. [/home/rickg/Desktop/AXISearch/pwm_ip_demo/pwm_ip_demo.gen/sources_1/bd/design_1/ip/design_1_microblaze_0_1/design_1_microblaze_0_1.xdc:102]
WARNING: [Vivado_Tcl 4-921] Waiver ID 'CDC-15' -to list should not be empty. [/home/rickg/Desktop/AXISearch/pwm_ip_demo/pwm_ip_demo.gen/sources_1/bd/design_1/ip/design_1_microblaze_0_1/design_1_microblaze_0_1.xdc:112]
WARNING: [Vivado_Tcl 4-921] Waiver ID 'CDC-15' -to list should not be empty. [/home/rickg/Desktop/AXISearch/pwm_ip_demo/pwm_ip_demo.gen/sources_1/bd/design_1/ip/design_1_microblaze_0_1/design_1_microblaze_0_1.xdc:137]
WARNING: [Vivado_Tcl 4-921] Waiver ID 'CDC-15' -to list should not be empty. [/home/rickg/Desktop/AXISearch/pwm_ip_demo/pwm_ip_demo.gen/sources_1/bd/design_1/ip/design_1_microblaze_0_1/design_1_microblaze_0_1.xdc:139]
WARNING: [Vivado_Tcl 4-919] Waiver ID 'CDC-1' -from list should not be empty. [/home/rickg/Desktop/AXISearch/pwm_ip_demo/pwm_ip_demo.gen/sources_1/bd/design_1/ip/design_1_microblaze_0_1/design_1_microblaze_0_1.xdc:145]
Finished Parsing XDC File [/home/rickg/Desktop/AXISearch/pwm_ip_demo/pwm_ip_demo.gen/sources_1/bd/design_1/ip/design_1_microblaze_0_1/design_1_microblaze_0_1.xdc] for cell 'design_1_i/microblaze_0/U0'
Parsing XDC File [/home/rickg/Desktop/AXISearch/pwm_ip_demo/pwm_ip_demo.gen/sources_1/bd/design_1/ip/design_1_clk_wiz_1_0/design_1_clk_wiz_1_0_board.xdc] for cell 'design_1_i/clk_wiz_1/inst'
Finished Parsing XDC File [/home/rickg/Desktop/AXISearch/pwm_ip_demo/pwm_ip_demo.gen/sources_1/bd/design_1/ip/design_1_clk_wiz_1_0/design_1_clk_wiz_1_0_board.xdc] for cell 'design_1_i/clk_wiz_1/inst'
Parsing XDC File [/home/rickg/Desktop/AXISearch/pwm_ip_demo/pwm_ip_demo.gen/sources_1/bd/design_1/ip/design_1_clk_wiz_1_0/design_1_clk_wiz_1_0.xdc] for cell 'design_1_i/clk_wiz_1/inst'
INFO: [Timing 38-35] Done setting XDC timing constraints. [/home/rickg/Desktop/AXISearch/pwm_ip_demo/pwm_ip_demo.gen/sources_1/bd/design_1/ip/design_1_clk_wiz_1_0/design_1_clk_wiz_1_0.xdc:54]
INFO: [Timing 38-2] Deriving generated clocks [/home/rickg/Desktop/AXISearch/pwm_ip_demo/pwm_ip_demo.gen/sources_1/bd/design_1/ip/design_1_clk_wiz_1_0/design_1_clk_wiz_1_0.xdc:54]
Finished Parsing XDC File [/home/rickg/Desktop/AXISearch/pwm_ip_demo/pwm_ip_demo.gen/sources_1/bd/design_1/ip/design_1_clk_wiz_1_0/design_1_clk_wiz_1_0.xdc] for cell 'design_1_i/clk_wiz_1/inst'
Parsing XDC File [/home/rickg/Desktop/AXISearch/pwm_ip_demo/pwm_ip_demo.gen/sources_1/bd/design_1/ip/design_1_rst_clk_wiz_1_100M_0/design_1_rst_clk_wiz_1_100M_0_board.xdc] for cell 'design_1_i/rst_clk_wiz_1_100M/U0'
Finished Parsing XDC File [/home/rickg/Desktop/AXISearch/pwm_ip_demo/pwm_ip_demo.gen/sources_1/bd/design_1/ip/design_1_rst_clk_wiz_1_100M_0/design_1_rst_clk_wiz_1_100M_0_board.xdc] for cell 'design_1_i/rst_clk_wiz_1_100M/U0'
Parsing XDC File [/home/rickg/Desktop/AXISearch/pwm_ip_demo/pwm_ip_demo.gen/sources_1/bd/design_1/ip/design_1_axi_smc_0/bd_0/ip/ip_1/bd_afc3_psr_aclk_0_board.xdc] for cell 'design_1_i/axi_smc/inst/clk_map/psr_aclk/U0'
Finished Parsing XDC File [/home/rickg/Desktop/AXISearch/pwm_ip_demo/pwm_ip_demo.gen/sources_1/bd/design_1/ip/design_1_axi_smc_0/bd_0/ip/ip_1/bd_afc3_psr_aclk_0_board.xdc] for cell 'design_1_i/axi_smc/inst/clk_map/psr_aclk/U0'
Parsing XDC File [/home/rickg/Desktop/AXISearch/pwm_ip_demo/pwm_ip_demo.gen/sources_1/bd/design_1/ip/design_1_axi_smc_0/smartconnect.xdc] for cell 'design_1_i/axi_smc/inst'
Finished Parsing XDC File [/home/rickg/Desktop/AXISearch/pwm_ip_demo/pwm_ip_demo.gen/sources_1/bd/design_1/ip/design_1_axi_smc_0/smartconnect.xdc] for cell 'design_1_i/axi_smc/inst'
Parsing XDC File [/home/rickg/Desktop/AXISearch/pwm_ip_demo/pwm_ip_demo.srcs/constrs_1/new/pwm_constr.xdc]
Finished Parsing XDC File [/home/rickg/Desktop/AXISearch/pwm_ip_demo/pwm_ip_demo.srcs/constrs_1/new/pwm_constr.xdc]
Parsing XDC File [/home/rickg/Desktop/AXISearch/pwm_ip_demo/pwm_ip_demo.gen/sources_1/bd/design_1/ip/design_1_mdm_1_0/design_1_mdm_1_0.xdc] for cell 'design_1_i/mdm_1/U0'
INFO: [Timing 38-2] Deriving generated clocks [/home/rickg/Desktop/AXISearch/pwm_ip_demo/pwm_ip_demo.gen/sources_1/bd/design_1/ip/design_1_mdm_1_0/design_1_mdm_1_0.xdc:4]
WARNING: [Vivado_Tcl 4-921] Waiver ID 'CDC-1' -to list should not be empty. [/home/rickg/Desktop/AXISearch/pwm_ip_demo/pwm_ip_demo.gen/sources_1/bd/design_1/ip/design_1_mdm_1_0/design_1_mdm_1_0.xdc:26]
WARNING: [Vivado_Tcl 4-921] Waiver ID 'CDC-1' -to list should not be empty. [/home/rickg/Desktop/AXISearch/pwm_ip_demo/pwm_ip_demo.gen/sources_1/bd/design_1/ip/design_1_mdm_1_0/design_1_mdm_1_0.xdc:36]
WARNING: [Vivado_Tcl 4-921] Waiver ID 'CDC-1' -to list should not be empty. [/home/rickg/Desktop/AXISearch/pwm_ip_demo/pwm_ip_demo.gen/sources_1/bd/design_1/ip/design_1_mdm_1_0/design_1_mdm_1_0.xdc:62]
WARNING: [Vivado_Tcl 4-921] Waiver ID 'CDC-1' -to list should not be empty. [/home/rickg/Desktop/AXISearch/pwm_ip_demo/pwm_ip_demo.gen/sources_1/bd/design_1/ip/design_1_mdm_1_0/design_1_mdm_1_0.xdc:64]
WARNING: [Vivado_Tcl 4-935] Waiver ID 'CDC-1' is a duplicate and will not be added again. [/home/rickg/Desktop/AXISearch/pwm_ip_demo/pwm_ip_demo.gen/sources_1/bd/design_1/ip/design_1_mdm_1_0/design_1_mdm_1_0.xdc:68]
WARNING: [Vivado_Tcl 4-921] Waiver ID 'CDC-1' -to list should not be empty. [/home/rickg/Desktop/AXISearch/pwm_ip_demo/pwm_ip_demo.gen/sources_1/bd/design_1/ip/design_1_mdm_1_0/design_1_mdm_1_0.xdc:82]
WARNING: [Vivado_Tcl 4-921] Waiver ID 'CDC-7' -to list should not be empty. [/home/rickg/Desktop/AXISearch/pwm_ip_demo/pwm_ip_demo.gen/sources_1/bd/design_1/ip/design_1_mdm_1_0/design_1_mdm_1_0.xdc:98]
WARNING: [Vivado_Tcl 4-919] Waiver ID 'CDC-13' -from list should not be empty. [/home/rickg/Desktop/AXISearch/pwm_ip_demo/pwm_ip_demo.gen/sources_1/bd/design_1/ip/design_1_mdm_1_0/design_1_mdm_1_0.xdc:116]
WARNING: [Vivado_Tcl 4-921] Waiver ID 'CDC-15' -to list should not be empty. [/home/rickg/Desktop/AXISearch/pwm_ip_demo/pwm_ip_demo.gen/sources_1/bd/design_1/ip/design_1_mdm_1_0/design_1_mdm_1_0.xdc:130]
WARNING: [Vivado_Tcl 4-921] Waiver ID 'CDC-15' -to list should not be empty. [/home/rickg/Desktop/AXISearch/pwm_ip_demo/pwm_ip_demo.gen/sources_1/bd/design_1/ip/design_1_mdm_1_0/design_1_mdm_1_0.xdc:132]
WARNING: [Vivado_Tcl 4-921] Waiver ID 'CDC-15' -to list should not be empty. [/home/rickg/Desktop/AXISearch/pwm_ip_demo/pwm_ip_demo.gen/sources_1/bd/design_1/ip/design_1_mdm_1_0/design_1_mdm_1_0.xdc:138]
Finished Parsing XDC File [/home/rickg/Desktop/AXISearch/pwm_ip_demo/pwm_ip_demo.gen/sources_1/bd/design_1/ip/design_1_mdm_1_0/design_1_mdm_1_0.xdc] for cell 'design_1_i/mdm_1/U0'
INFO: [Project 1-1714] 18 XPM XDC files have been applied to the design.
INFO: [Opt 31-138] Pushed 0 inverter(s) to 0 load pin(s).
Generating merged BMM file for the design top 'design_1_wrapper'...
INFO: [Memdata 28-144] Successfully populated the BRAM INIT strings from the following elf files: /home/rickg/Desktop/AXISearch/pwm_ip_demo/pwm_ip_demo.gen/sources_1/bd/design_1/ip/design_1_microblaze_0_1/data/mb_bootloop_le.elf 
Netlist sorting complete. Time (s): cpu = 00:00:00 ; elapsed = 00:00:00.01 . Memory (MB): peak = 2520.633 ; gain = 0.000 ; free physical = 5238 ; free virtual = 8021
INFO: [Project 1-111] Unisim Transformation Summary:
  A total of 96 instances were transformed.
  LUT6_2 => LUT6_2 (LUT5, LUT6): 80 instances
  RAM32M => RAM32M (RAMD32(x6), RAMS32(x2)): 16 instances

27 Infos, 24 Warnings, 0 Critical Warnings and 0 Errors encountered.
link_design completed successfully
link_design: Time (s): cpu = 00:00:07 ; elapsed = 00:00:07 . Memory (MB): peak = 2520.668 ; gain = 970.719 ; free physical = 5238 ; free virtual = 8021
Command: opt_design
Attempting to get a license for feature 'Implementation' and/or device 'xc7z020'
INFO: [Common 17-349] Got license for feature 'Implementation' and/or device 'xc7z020'
Running DRC as a precondition to command opt_design

Starting DRC Task
INFO: [DRC 23-27] Running DRC with 8 threads
INFO: [Project 1-461] DRC finished with 0 Errors
INFO: [Project 1-462] Please refer to the DRC report (report_drc) for more information.

Time (s): cpu = 00:00:02 ; elapsed = 00:00:00.39 . Memory (MB): peak = 2534.508 ; gain = 13.840 ; free physical = 5174 ; free virtual = 7957

Starting Cache Timing Information Task
INFO: [Timing 38-35] Done setting XDC timing constraints.
Ending Cache Timing Information Task | Checksum: 1e9b40714

Time (s): cpu = 00:00:00.16 ; elapsed = 00:00:00.1 . Memory (MB): peak = 2534.508 ; gain = 0.000 ; free physical = 5170 ; free virtual = 7953

Starting Logic Optimization Task

Phase 1 Initialization

Phase 1.1 Core Generation And Design Setup
Phase 1.1 Core Generation And Design Setup | Checksum: 1e9b40714

Time (s): cpu = 00:00:00 ; elapsed = 00:00:00 . Memory (MB): peak = 2857.320 ; gain = 0.000 ; free physical = 4836 ; free virtual = 7620

Phase 1.2 Setup Constraints And Sort Netlist
Phase 1.2 Setup Constraints And Sort Netlist | Checksum: 1e9b40714

Time (s): cpu = 00:00:00 ; elapsed = 00:00:00 . Memory (MB): peak = 2857.320 ; gain = 0.000 ; free physical = 4836 ; free virtual = 7620
Phase 1 Initialization | Checksum: 1e9b40714

Time (s): cpu = 00:00:00.01 ; elapsed = 00:00:00.01 . Memory (MB): peak = 2857.320 ; gain = 0.000 ; free physical = 4836 ; free virtual = 7620

Phase 2 Timer Update And Timing Data Collection

Phase 2.1 Timer Update
Phase 2.1 Timer Update | Checksum: 1e9b40714

Time (s): cpu = 00:00:00.16 ; elapsed = 00:00:00.05 . Memory (MB): peak = 2857.320 ; gain = 0.000 ; free physical = 4836 ; free virtual = 7620

Phase 2.2 Timing Data Collection
Phase 2.2 Timing Data Collection | Checksum: 1e9b40714

Time (s): cpu = 00:00:00.17 ; elapsed = 00:00:00.06 . Memory (MB): peak = 2857.320 ; gain = 0.000 ; free physical = 4836 ; free virtual = 7620
Phase 2 Timer Update And Timing Data Collection | Checksum: 1e9b40714

Time (s): cpu = 00:00:00.17 ; elapsed = 00:00:00.06 . Memory (MB): peak = 2857.320 ; gain = 0.000 ; free physical = 4836 ; free virtual = 7620

Phase 3 Retarget
INFO: [Opt 31-1851] Number of loadless carry chains removed were: 0
INFO: [Opt 31-1834] Total Chains To Be Transformed Were: 0 AND Number of Transformed insts Created are: 0
INFO: [Opt 31-1566] Pulled 1 inverters resulting in an inversion of 14 pins
INFO: [Opt 31-138] Pushed 11 inverter(s) to 31 load pin(s).
INFO: [Opt 31-49] Retargeted 0 cell(s).
Phase 3 Retarget | Checksum: 114d7bd94

Time (s): cpu = 00:00:00.28 ; elapsed = 00:00:00.14 . Memory (MB): peak = 2857.320 ; gain = 0.000 ; free physical = 4836 ; free virtual = 7620
Retarget | Checksum: 114d7bd94
INFO: [Opt 31-389] Phase Retarget created 19 cells and removed 50 cells
INFO: [Opt 31-1021] In phase Retarget, 22 netlist objects are constrained preventing optimization. Please run opt_design with -debug_log to get more detail. 

Phase 4 Constant propagation
INFO: [Opt 31-138] Pushed 0 inverter(s) to 0 load pin(s).
Phase 4 Constant propagation | Checksum: 1c044bfbc

Time (s): cpu = 00:00:00.29 ; elapsed = 00:00:00.16 . Memory (MB): peak = 2857.320 ; gain = 0.000 ; free physical = 4836 ; free virtual = 7620
Constant propagation | Checksum: 1c044bfbc
INFO: [Opt 31-389] Phase Constant propagation created 5 cells and removed 34 cells
INFO: [Opt 31-1021] In phase Constant propagation, 21 netlist objects are constrained preventing optimization. Please run opt_design with -debug_log to get more detail. 

Phase 5 Sweep
INFO: [Constraints 18-11670] Building netlist checker database with flags, 0x8
Done building netlist checker database: Time (s): cpu = 00:00:00.01 ; elapsed = 00:00:00 . Memory (MB): peak = 2857.320 ; gain = 0.000 ; free physical = 4836 ; free virtual = 7619
INFO: [Constraints 18-11670] Building netlist checker database with flags, 0x8
Done building netlist checker database: Time (s): cpu = 00:00:00 ; elapsed = 00:00:00 . Memory (MB): peak = 2857.320 ; gain = 0.000 ; free physical = 4836 ; free virtual = 7619
Phase 5 Sweep | Checksum: 1365c6d79

Time (s): cpu = 00:00:00.51 ; elapsed = 00:00:00.38 . Memory (MB): peak = 2857.320 ; gain = 0.000 ; free physical = 4836 ; free virtual = 7619
Sweep | Checksum: 1365c6d79
INFO: [Opt 31-389] Phase Sweep created 0 cells and removed 94 cells
INFO: [Opt 31-1021] In phase Sweep, 26 netlist objects are constrained preventing optimization. Please run opt_design with -debug_log to get more detail. 

Phase 6 BUFG optimization
INFO: [Opt 31-194] Inserted BUFG design_1_i/mdm_1/U0/Use_E2.BSCAN_I/Dbg_Update_0_BUFG_inst to drive 39 load(s) on clock net design_1_i/mdm_1/U0/Use_E2.BSCAN_I/Dbg_Update_0_BUFG
INFO: [Opt 31-193] Inserted 1 BUFG(s) on clock nets
Phase 6 BUFG optimization | Checksum: 1893ccd61

Time (s): cpu = 00:00:00.55 ; elapsed = 00:00:00.4 . Memory (MB): peak = 2889.336 ; gain = 32.016 ; free physical = 4836 ; free virtual = 7619
BUFG optimization | Checksum: 1893ccd61
INFO: [Opt 31-662] Phase BUFG optimization created 1 cells of which 1 are BUFGs and removed 0 cells.

Phase 7 Shift Register Optimization
INFO: [Opt 31-1064] SRL Remap converted 0 SRLs to 0 registers and converted 0 registers of register chains to 0 SRLs
Phase 7 Shift Register Optimization | Checksum: 1893ccd61

Time (s): cpu = 00:00:00.55 ; elapsed = 00:00:00.4 . Memory (MB): peak = 2889.336 ; gain = 32.016 ; free physical = 4836 ; free virtual = 7619
Shift Register Optimization | Checksum: 1893ccd61
INFO: [Opt 31-389] Phase Shift Register Optimization created 0 cells and removed 0 cells

Phase 8 Post Processing Netlist
Phase 8 Post Processing Netlist | Checksum: 1893ccd61

Time (s): cpu = 00:00:00.56 ; elapsed = 00:00:00.41 . Memory (MB): peak = 2889.336 ; gain = 32.016 ; free physical = 4836 ; free virtual = 7619
Post Processing Netlist | Checksum: 1893ccd61
INFO: [Opt 31-389] Phase Post Processing Netlist created 0 cells and removed 0 cells
INFO: [Opt 31-1021] In phase Post Processing Netlist, 21 netlist objects are constrained preventing optimization. Please run opt_design with -debug_log to get more detail. 

Phase 9 Finalization

Phase 9.1 Finalizing Design Cores and Updating Shapes
Phase 9.1 Finalizing Design Cores and Updating Shapes | Checksum: 29a2f4bba

Time (s): cpu = 00:00:00.65 ; elapsed = 00:00:00.46 . Memory (MB): peak = 2889.336 ; gain = 32.016 ; free physical = 4836 ; free virtual = 7619

Phase 9.2 Verifying Netlist Connectivity

Starting Connectivity Check Task

Time (s): cpu = 00:00:00 ; elapsed = 00:00:00.01 . Memory (MB): peak = 2889.336 ; gain = 0.000 ; free physical = 4836 ; free virtual = 7619
Phase 9.2 Verifying Netlist Connectivity | Checksum: 29a2f4bba

Time (s): cpu = 00:00:00.65 ; elapsed = 00:00:00.47 . Memory (MB): peak = 2889.336 ; gain = 32.016 ; free physical = 4836 ; free virtual = 7619
Phase 9 Finalization | Checksum: 29a2f4bba

Time (s): cpu = 00:00:00.65 ; elapsed = 00:00:00.47 . Memory (MB): peak = 2889.336 ; gain = 32.016 ; free physical = 4836 ; free virtual = 7619
Opt_design Change Summary
=========================


-------------------------------------------------------------------------------------------------------------------------
|  Phase                        |  #Cells created  |  #Cells Removed  |  #Constrained objects preventing optimizations  |
-------------------------------------------------------------------------------------------------------------------------
|  Retarget                     |              19  |              50  |                                             22  |
|  Constant propagation         |               5  |              34  |                                             21  |
|  Sweep                        |               0  |              94  |                                             26  |
|  BUFG optimization            |               1  |               0  |                                              0  |
|  Shift Register Optimization  |               0  |               0  |                                              0  |
|  Post Processing Netlist      |               0  |               0  |                                             21  |
-------------------------------------------------------------------------------------------------------------------------


Ending Logic Optimization Task | Checksum: 29a2f4bba

Time (s): cpu = 00:00:00.65 ; elapsed = 00:00:00.47 . Memory (MB): peak = 2889.336 ; gain = 32.016 ; free physical = 4836 ; free virtual = 7619

Starting Power Optimization Task
INFO: [Pwropt 34-132] Skipping clock gating for clocks with a period < 2.00 ns.
INFO: [Pwropt 34-9] Applying IDT optimizations ...
INFO: [Pwropt 34-10] Applying ODC optimizations ...
INFO: [Timing 38-35] Done setting XDC timing constraints.
Running Vector-less Activity Propagation...

Finished Running Vector-less Activity Propagation


Starting PowerOpt Patch Enables Task
INFO: [Pwropt 34-162] WRITE_MODE attribute of 0 BRAM(s) out of a total of 4 has been updated to save power. Run report_power_opt to get a complete listing of the BRAMs updated.
INFO: [Pwropt 34-201] Structural ODC has moved 0 WE to EN ports
Number of BRAM Ports augmented: 4 newly gated: 0 Total Ports: 8
Ending PowerOpt Patch Enables Task | Checksum: 16c0f6240

Time (s): cpu = 00:00:00.04 ; elapsed = 00:00:00.04 . Memory (MB): peak = 3187.266 ; gain = 0.000 ; free physical = 4752 ; free virtual = 7536
Ending Power Optimization Task | Checksum: 16c0f6240

Time (s): cpu = 00:00:01 ; elapsed = 00:00:00.52 . Memory (MB): peak = 3187.266 ; gain = 297.930 ; free physical = 4752 ; free virtual = 7536

Starting Final Cleanup Task

Starting Logic Optimization Task
INFO: [Timing 38-35] Done setting XDC timing constraints.
Ending Logic Optimization Task | Checksum: 1a8319dd9

Time (s): cpu = 00:00:00.38 ; elapsed = 00:00:00.2 . Memory (MB): peak = 3187.266 ; gain = 0.000 ; free physical = 4751 ; free virtual = 7535
Ending Final Cleanup Task | Checksum: 1a8319dd9

Time (s): cpu = 00:00:02 ; elapsed = 00:00:02 . Memory (MB): peak = 3187.266 ; gain = 0.000 ; free physical = 4751 ; free virtual = 7535

Starting Netlist Obfuscation Task
Netlist sorting complete. Time (s): cpu = 00:00:00 ; elapsed = 00:00:00 . Memory (MB): peak = 3187.266 ; gain = 0.000 ; free physical = 4751 ; free virtual = 7535
Ending Netlist Obfuscation Task | Checksum: 1a8319dd9

Time (s): cpu = 00:00:00 ; elapsed = 00:00:00 . Memory (MB): peak = 3187.266 ; gain = 0.000 ; free physical = 4751 ; free virtual = 7535
INFO: [Common 17-83] Releasing license: Implementation
61 Infos, 24 Warnings, 0 Critical Warnings and 0 Errors encountered.
opt_design completed successfully
INFO: [Vivado 12-24828] Executing command : report_drc -file design_1_wrapper_drc_opted.rpt -pb design_1_wrapper_drc_opted.pb -rpx design_1_wrapper_drc_opted.rpx
Command: report_drc -file design_1_wrapper_drc_opted.rpt -pb design_1_wrapper_drc_opted.pb -rpx design_1_wrapper_drc_opted.rpx
INFO: [IP_Flow 19-1839] IP Catalog is up to date.
INFO: [DRC 23-27] Running DRC with 8 threads
INFO: [Vivado_Tcl 2-168] The results of DRC are in file /home/rickg/Desktop/AXISearch/pwm_ip_demo/pwm_ip_demo.runs/impl_1/design_1_wrapper_drc_opted.rpt.
report_drc completed successfully
INFO: [Timing 38-35] Done setting XDC timing constraints.
INFO: [Timing 38-480] Writing timing data to binary archive.
Wrote PlaceDB: Time (s): cpu = 00:00:00 ; elapsed = 00:00:00 . Memory (MB): peak = 3187.266 ; gain = 0.000 ; free physical = 4738 ; free virtual = 7522
Wrote PulsedLatchDB: Time (s): cpu = 00:00:00 ; elapsed = 00:00:00 . Memory (MB): peak = 3187.266 ; gain = 0.000 ; free physical = 4738 ; free virtual = 7522
Writing XDEF routing.
Write ShapeDB Complete: Time (s): cpu = 00:00:00.01 ; elapsed = 00:00:00 . Memory (MB): peak = 3187.266 ; gain = 0.000 ; free physical = 4738 ; free virtual = 7522
Writing XDEF routing logical nets.
Writing XDEF routing special nets.
Wrote RouteStorage: Time (s): cpu = 00:00:00.05 ; elapsed = 00:00:00.01 . Memory (MB): peak = 3187.266 ; gain = 0.000 ; free physical = 4735 ; free virtual = 7519
Wrote Netlist Cache: Time (s): cpu = 00:00:00 ; elapsed = 00:00:00 . Memory (MB): peak = 3187.266 ; gain = 0.000 ; free physical = 4735 ; free virtual = 7518
Wrote Device Cache: Time (s): cpu = 00:00:00.02 ; elapsed = 00:00:00.01 . Memory (MB): peak = 3187.266 ; gain = 0.000 ; free physical = 4731 ; free virtual = 7515
Write Physdb Complete: Time (s): cpu = 00:00:00.09 ; elapsed = 00:00:00.02 . Memory (MB): peak = 3187.266 ; gain = 0.000 ; free physical = 4731 ; free virtual = 7515
INFO: [Common 17-1381] The checkpoint '/home/rickg/Desktop/AXISearch/pwm_ip_demo/pwm_ip_demo.runs/impl_1/design_1_wrapper_opt.dcp' has been generated.
Command: place_design
Attempting to get a license for feature 'Implementation' and/or device 'xc7z020'
INFO: [Common 17-349] Got license for feature 'Implementation' and/or device 'xc7z020'
INFO: [Common 17-83] Releasing license: Implementation
INFO: [DRC 23-27] Running DRC with 8 threads
INFO: [Vivado_Tcl 4-198] DRC finished with 0 Errors
INFO: [Vivado_Tcl 4-199] Please refer to the DRC report (report_drc) for more information.
Running DRC as a precondition to command place_design
INFO: [DRC 23-27] Running DRC with 8 threads
INFO: [Vivado_Tcl 4-198] DRC finished with 0 Errors
INFO: [Vivado_Tcl 4-199] Please refer to the DRC report (report_drc) for more information.
INFO: [Place 30-611] Multithreading enabled for place_design using a maximum of 8 CPUs

Starting Placer Task

Phase 1 Placer Initialization

Phase 1.1 Placer Initialization Netlist Sorting
Netlist sorting complete. Time (s): cpu = 00:00:00 ; elapsed = 00:00:00 . Memory (MB): peak = 3187.266 ; gain = 0.000 ; free physical = 4694 ; free virtual = 7479
Phase 1.1 Placer Initialization Netlist Sorting | Checksum: 147810802

Time (s): cpu = 00:00:00 ; elapsed = 00:00:00 . Memory (MB): peak = 3187.266 ; gain = 0.000 ; free physical = 4694 ; free virtual = 7479
Netlist sorting complete. Time (s): cpu = 00:00:00 ; elapsed = 00:00:00 . Memory (MB): peak = 3187.266 ; gain = 0.000 ; free physical = 4694 ; free virtual = 7479

Phase 1.2 IO Placement/ Clock Placement/ Build Placer Device
Phase 1.2 IO Placement/ Clock Placement/ Build Placer Device | Checksum: 16691f5dd

Time (s): cpu = 00:00:00.32 ; elapsed = 00:00:00.14 . Memory (MB): peak = 3187.266 ; gain = 0.000 ; free physical = 4690 ; free virtual = 7475

Phase 1.3 Build Placer Netlist Model
Phase 1.3 Build Placer Netlist Model | Checksum: 216c18ea1

Time (s): cpu = 00:00:00.98 ; elapsed = 00:00:00.42 . Memory (MB): peak = 3187.266 ; gain = 0.000 ; free physical = 4691 ; free virtual = 7476

Phase 1.4 Constrain Clocks/Macros
Phase 1.4 Constrain Clocks/Macros | Checksum: 216c18ea1

Time (s): cpu = 00:00:00.98 ; elapsed = 00:00:00.42 . Memory (MB): peak = 3187.266 ; gain = 0.000 ; free physical = 4691 ; free virtual = 7476
Phase 1 Placer Initialization | Checksum: 216c18ea1

Time (s): cpu = 00:00:01 ; elapsed = 00:00:00.44 . Memory (MB): peak = 3187.266 ; gain = 0.000 ; free physical = 4691 ; free virtual = 7476

Phase 2 Global Placement

Phase 2.1 Floorplanning
Phase 2.1 Floorplanning | Checksum: 1e9f4abf5

Time (s): cpu = 00:00:01 ; elapsed = 00:00:00.54 . Memory (MB): peak = 3187.266 ; gain = 0.000 ; free physical = 4695 ; free virtual = 7480

Phase 2.2 Update Timing before SLR Path Opt
Phase 2.2 Update Timing before SLR Path Opt | Checksum: 19a91407c

Time (s): cpu = 00:00:01 ; elapsed = 00:00:00.6 . Memory (MB): peak = 3187.266 ; gain = 0.000 ; free physical = 4739 ; free virtual = 7523

Phase 2.3 Post-Processing in Floorplanning
Phase 2.3 Post-Processing in Floorplanning | Checksum: 19a91407c

Time (s): cpu = 00:00:02 ; elapsed = 00:00:00.61 . Memory (MB): peak = 3187.266 ; gain = 0.000 ; free physical = 4739 ; free virtual = 7524

Phase 2.4 Global Place Phase1
Phase 2.4 Global Place Phase1 | Checksum: 1b8131346

Time (s): cpu = 00:00:06 ; elapsed = 00:00:02 . Memory (MB): peak = 3187.266 ; gain = 0.000 ; free physical = 4756 ; free virtual = 7541

Phase 2.5 Global Place Phase2

Phase 2.5.1 UpdateTiming Before Physical Synthesis
Phase 2.5.1 UpdateTiming Before Physical Synthesis | Checksum: e375aa8e

Time (s): cpu = 00:00:06 ; elapsed = 00:00:02 . Memory (MB): peak = 3187.266 ; gain = 0.000 ; free physical = 4750 ; free virtual = 7535

Phase 2.5.2 Physical Synthesis In Placer
INFO: [Physopt 32-1035] Found 0 LUTNM shape to break, 121 LUT instances to create LUTNM shape
INFO: [Physopt 32-1044] Break lutnm for timing: one critical 0, two critical 0, total 0, new lutff created 0
INFO: [Physopt 32-1138] End 1 Pass. Optimized 58 nets or LUTs. Breaked 0 LUT, combined 58 existing LUTs and moved 0 existing LUT
INFO: [Physopt 32-65] No nets found for high-fanout optimization.
INFO: [Physopt 32-232] Optimized 0 net. Created 0 new instance.
INFO: [Physopt 32-775] End 1 Pass. Optimized 0 net or cell. Created 0 new cell, deleted 0 existing cell and moved 0 existing cell
INFO: [Physopt 32-670] No setup violation found.  DSP Register Optimization was not performed.
INFO: [Physopt 32-670] No setup violation found.  Shift Register to Pipeline Optimization was not performed.
INFO: [Physopt 32-670] No setup violation found.  Shift Register Optimization was not performed.
INFO: [Physopt 32-670] No setup violation found.  BRAM Register Optimization was not performed.
INFO: [Physopt 32-670] No setup violation found.  URAM Register Optimization was not performed.
INFO: [Physopt 32-949] No candidate nets found for dynamic/static region interface net replication
INFO: [Physopt 32-775] End 1 Pass. Optimized 0 net or cell. Created 0 new cell, deleted 0 existing cell and moved 0 existing cell
Netlist sorting complete. Time (s): cpu = 00:00:00 ; elapsed = 00:00:00 . Memory (MB): peak = 3187.266 ; gain = 0.000 ; free physical = 4750 ; free virtual = 7535

Summary of Physical Synthesis Optimizations
============================================


-----------------------------------------------------------------------------------------------------------------------------------------------------------
|  Optimization                                     |  Added Cells  |  Removed Cells  |  Optimized Cells/Nets  |  Dont Touch  |  Iterations  |  Elapsed   |
-----------------------------------------------------------------------------------------------------------------------------------------------------------
|  LUT Combining                                    |            0  |             58  |                    58  |           0  |           1  |  00:00:00  |
|  Retime                                           |            0  |              0  |                     0  |           0  |           1  |  00:00:00  |
|  Very High Fanout                                 |            0  |              0  |                     0  |           0  |           1  |  00:00:00  |
|  DSP Register                                     |            0  |              0  |                     0  |           0  |           0  |  00:00:00  |
|  Shift Register to Pipeline                       |            0  |              0  |                     0  |           0  |           0  |  00:00:00  |
|  Shift Register                                   |            0  |              0  |                     0  |           0  |           0  |  00:00:00  |
|  BRAM Register                                    |            0  |              0  |                     0  |           0  |           0  |  00:00:00  |
|  URAM Register                                    |            0  |              0  |                     0  |           0  |           0  |  00:00:00  |
|  Dynamic/Static Region Interface Net Replication  |            0  |              0  |                     0  |           0  |           1  |  00:00:00  |
|  Total                                            |            0  |             58  |                    58  |           0  |           4  |  00:00:00  |
-----------------------------------------------------------------------------------------------------------------------------------------------------------


Phase 2.5.2 Physical Synthesis In Placer | Checksum: d4a33a52

Time (s): cpu = 00:00:06 ; elapsed = 00:00:02 . Memory (MB): peak = 3187.266 ; gain = 0.000 ; free physical = 4750 ; free virtual = 7535
Phase 2.5 Global Place Phase2 | Checksum: fb89168e

Time (s): cpu = 00:00:07 ; elapsed = 00:00:02 . Memory (MB): peak = 3187.266 ; gain = 0.000 ; free physical = 4749 ; free virtual = 7534
Phase 2 Global Placement | Checksum: fb89168e

Time (s): cpu = 00:00:07 ; elapsed = 00:00:02 . Memory (MB): peak = 3187.266 ; gain = 0.000 ; free physical = 4749 ; free virtual = 7534

Phase 3 Detail Placement

Phase 3.1 Commit Multi Column Macros
Phase 3.1 Commit Multi Column Macros | Checksum: 17812f014

Time (s): cpu = 00:00:07 ; elapsed = 00:00:02 . Memory (MB): peak = 3187.266 ; gain = 0.000 ; free physical = 4749 ; free virtual = 7534

Phase 3.2 Commit Most Macros & LUTRAMs
Phase 3.2 Commit Most Macros & LUTRAMs | Checksum: 1d0f71854

Time (s): cpu = 00:00:07 ; elapsed = 00:00:02 . Memory (MB): peak = 3187.266 ; gain = 0.000 ; free physical = 4749 ; free virtual = 7534

Phase 3.3 Area Swap Optimization
Phase 3.3 Area Swap Optimization | Checksum: 1fbeaac1f

Time (s): cpu = 00:00:07 ; elapsed = 00:00:02 . Memory (MB): peak = 3187.266 ; gain = 0.000 ; free physical = 4749 ; free virtual = 7534

Phase 3.4 Pipeline Register Optimization
Phase 3.4 Pipeline Register Optimization | Checksum: 1f8aa7eda

Time (s): cpu = 00:00:07 ; elapsed = 00:00:02 . Memory (MB): peak = 3187.266 ; gain = 0.000 ; free physical = 4749 ; free virtual = 7534

Phase 3.5 Small Shape Detail Placement
Phase 3.5 Small Shape Detail Placement | Checksum: 2877bfafc

Time (s): cpu = 00:00:08 ; elapsed = 00:00:03 . Memory (MB): peak = 3187.266 ; gain = 0.000 ; free physical = 4747 ; free virtual = 7532

Phase 3.6 Re-assign LUT pins
Phase 3.6 Re-assign LUT pins | Checksum: 23b5fe5f3

Time (s): cpu = 00:00:08 ; elapsed = 00:00:03 . Memory (MB): peak = 3187.266 ; gain = 0.000 ; free physical = 4747 ; free virtual = 7532

Phase 3.7 Pipeline Register Optimization
Phase 3.7 Pipeline Register Optimization | Checksum: 206f1bdc4

Time (s): cpu = 00:00:08 ; elapsed = 00:00:03 . Memory (MB): peak = 3187.266 ; gain = 0.000 ; free physical = 4747 ; free virtual = 7532
Phase 3 Detail Placement | Checksum: 206f1bdc4

Time (s): cpu = 00:00:08 ; elapsed = 00:00:03 . Memory (MB): peak = 3187.266 ; gain = 0.000 ; free physical = 4747 ; free virtual = 7532

Phase 4 Post Placement Optimization and Clean-Up

Phase 4.1 Post Commit Optimization
INFO: [Timing 38-35] Done setting XDC timing constraints.

Phase 4.1.1 Post Placement Optimization
Post Placement Optimization Initialization | Checksum: 1eec84faa

Phase 4.1.1.1 BUFG Insertion

Starting Physical Synthesis Task

Phase 1 Physical Synthesis Initialization
INFO: [Physopt 32-721] Multithreading enabled for phys_opt_design using a maximum of 8 CPUs
INFO: [Physopt 32-619] Estimated Timing Summary | WNS=2.782 | TNS=0.000 |
Phase 1 Physical Synthesis Initialization | Checksum: 1aac7660f

Time (s): cpu = 00:00:00.17 ; elapsed = 00:00:00.04 . Memory (MB): peak = 3187.266 ; gain = 0.000 ; free physical = 4747 ; free virtual = 7532
INFO: [Place 46-56] BUFG insertion identified 0 candidate nets. Inserted BUFG: 0, Replicated BUFG Driver: 0, Skipped due to Placement/Routing Conflicts: 0, Skipped due to Timing Degradation: 0, Skipped due to netlist editing failed: 0.
Ending Physical Synthesis Task | Checksum: 1b0b9faec

Time (s): cpu = 00:00:00.19 ; elapsed = 00:00:00.05 . Memory (MB): peak = 3187.266 ; gain = 0.000 ; free physical = 4747 ; free virtual = 7532
Phase 4.1.1.1 BUFG Insertion | Checksum: 1eec84faa

Time (s): cpu = 00:00:09 ; elapsed = 00:00:03 . Memory (MB): peak = 3187.266 ; gain = 0.000 ; free physical = 4747 ; free virtual = 7532

Phase 4.1.1.2 Post Placement Timing Optimization
INFO: [Place 30-746] Post Placement Timing Summary WNS=2.782. For the most accurate timing information please run report_timing.
Phase 4.1.1.2 Post Placement Timing Optimization | Checksum: 22ff5ce02

Time (s): cpu = 00:00:09 ; elapsed = 00:00:03 . Memory (MB): peak = 3187.266 ; gain = 0.000 ; free physical = 4747 ; free virtual = 7532

Time (s): cpu = 00:00:09 ; elapsed = 00:00:03 . Memory (MB): peak = 3187.266 ; gain = 0.000 ; free physical = 4747 ; free virtual = 7532
Phase 4.1 Post Commit Optimization | Checksum: 22ff5ce02

Time (s): cpu = 00:00:09 ; elapsed = 00:00:03 . Memory (MB): peak = 3187.266 ; gain = 0.000 ; free physical = 4747 ; free virtual = 7532

Phase 4.2 Post Placement Cleanup
Phase 4.2 Post Placement Cleanup | Checksum: 22ff5ce02

Time (s): cpu = 00:00:09 ; elapsed = 00:00:03 . Memory (MB): peak = 3187.266 ; gain = 0.000 ; free physical = 4747 ; free virtual = 7532

Phase 4.3 Placer Reporting

Phase 4.3.1 Print Estimated Congestion
INFO: [Place 30-612] Post-Placement Estimated Congestion 
 ____________________________________________________
|           | Global Congestion | Short Congestion  |
| Direction | Region Size       | Region Size       |
|___________|___________________|___________________|
|      North|                1x1|                1x1|
|___________|___________________|___________________|
|      South|                1x1|                1x1|
|___________|___________________|___________________|
|       East|                1x1|                1x1|
|___________|___________________|___________________|
|       West|                1x1|                1x1|
|___________|___________________|___________________|

Phase 4.3.1 Print Estimated Congestion | Checksum: 22ff5ce02

Time (s): cpu = 00:00:09 ; elapsed = 00:00:03 . Memory (MB): peak = 3187.266 ; gain = 0.000 ; free physical = 4747 ; free virtual = 7532
Phase 4.3 Placer Reporting | Checksum: 22ff5ce02

Time (s): cpu = 00:00:09 ; elapsed = 00:00:03 . Memory (MB): peak = 3187.266 ; gain = 0.000 ; free physical = 4747 ; free virtual = 7532

Phase 4.4 Final Placement Cleanup
Netlist sorting complete. Time (s): cpu = 00:00:00.01 ; elapsed = 00:00:00 . Memory (MB): peak = 3187.266 ; gain = 0.000 ; free physical = 4747 ; free virtual = 7532

Time (s): cpu = 00:00:09 ; elapsed = 00:00:03 . Memory (MB): peak = 3187.266 ; gain = 0.000 ; free physical = 4747 ; free virtual = 7532
Phase 4 Post Placement Optimization and Clean-Up | Checksum: 24fa5c4fd

Time (s): cpu = 00:00:09 ; elapsed = 00:00:03 . Memory (MB): peak = 3187.266 ; gain = 0.000 ; free physical = 4747 ; free virtual = 7532
Ending Placer Task | Checksum: 16fb95c10

Time (s): cpu = 00:00:09 ; elapsed = 00:00:03 . Memory (MB): peak = 3187.266 ; gain = 0.000 ; free physical = 4747 ; free virtual = 7532
96 Infos, 24 Warnings, 0 Critical Warnings and 0 Errors encountered.
place_design completed successfully
INFO: [Vivado 12-24838] Running report commands "report_control_sets, report_io, report_utilization" in parallel.
Running report generation with 3 threads.
INFO: [Vivado 12-24828] Executing command : report_control_sets -verbose -file design_1_wrapper_control_sets_placed.rpt
report_control_sets: Time (s): cpu = 00:00:00.08 ; elapsed = 00:00:00.08 . Memory (MB): peak = 3187.266 ; gain = 0.000 ; free physical = 4732 ; free virtual = 7517
INFO: [Vivado 12-24828] Executing command : report_utilization -file design_1_wrapper_utilization_placed.rpt -pb design_1_wrapper_utilization_placed.pb
INFO: [Vivado 12-24828] Executing command : report_io -file design_1_wrapper_io_placed.rpt
report_io: Time (s): cpu = 00:00:00.1 ; elapsed = 00:00:00.15 . Memory (MB): peak = 3187.266 ; gain = 0.000 ; free physical = 4716 ; free virtual = 7501
INFO: [Timing 38-480] Writing timing data to binary archive.
Write ShapeDB Complete: Time (s): cpu = 00:00:00.01 ; elapsed = 00:00:00.01 . Memory (MB): peak = 3187.266 ; gain = 0.000 ; free physical = 4716 ; free virtual = 7501
Wrote PlaceDB: Time (s): cpu = 00:00:00.28 ; elapsed = 00:00:00.07 . Memory (MB): peak = 3187.266 ; gain = 0.000 ; free physical = 4715 ; free virtual = 7504
Wrote PulsedLatchDB: Time (s): cpu = 00:00:00 ; elapsed = 00:00:00 . Memory (MB): peak = 3187.266 ; gain = 0.000 ; free physical = 4715 ; free virtual = 7504
Writing XDEF routing.
Writing XDEF routing logical nets.
Writing XDEF routing special nets.
Wrote RouteStorage: Time (s): cpu = 00:00:00.05 ; elapsed = 00:00:00.02 . Memory (MB): peak = 3187.266 ; gain = 0.000 ; free physical = 4715 ; free virtual = 7504
Wrote Netlist Cache: Time (s): cpu = 00:00:00.01 ; elapsed = 00:00:00 . Memory (MB): peak = 3187.266 ; gain = 0.000 ; free physical = 4715 ; free virtual = 7504
Wrote Device Cache: Time (s): cpu = 00:00:00.02 ; elapsed = 00:00:00.01 . Memory (MB): peak = 3187.266 ; gain = 0.000 ; free physical = 4715 ; free virtual = 7505
Write Physdb Complete: Time (s): cpu = 00:00:00.37 ; elapsed = 00:00:00.1 . Memory (MB): peak = 3187.266 ; gain = 0.000 ; free physical = 4715 ; free virtual = 7505
INFO: [Common 17-1381] The checkpoint '/home/rickg/Desktop/AXISearch/pwm_ip_demo/pwm_ip_demo.runs/impl_1/design_1_wrapper_placed.dcp' has been generated.
Command: phys_opt_design
Attempting to get a license for feature 'Implementation' and/or device 'xc7z020'
INFO: [Common 17-349] Got license for feature 'Implementation' and/or device 'xc7z020'

Starting Initial Update Timing Task

Time (s): cpu = 00:00:00.61 ; elapsed = 00:00:00.14 . Memory (MB): peak = 3187.266 ; gain = 0.000 ; free physical = 4707 ; free virtual = 7494
INFO: [Vivado_Tcl 4-2279] Estimated Timing Summary | WNS= 2.782 | TNS= 0.000 | 
INFO: [Vivado_Tcl 4-383] Design worst setup slack (WNS) is greater than or equal to 0.000 ns. All physical synthesis setup optimizations will be skipped.
INFO: [Vivado_Tcl 4-232] No setup violation found. The netlist was not modified.
INFO: [Common 17-83] Releasing license: Implementation
107 Infos, 24 Warnings, 0 Critical Warnings and 0 Errors encountered.
phys_opt_design completed successfully
INFO: [Timing 38-480] Writing timing data to binary archive.
Write ShapeDB Complete: Time (s): cpu = 00:00:00.02 ; elapsed = 00:00:00 . Memory (MB): peak = 3187.266 ; gain = 0.000 ; free physical = 4707 ; free virtual = 7495
Wrote PlaceDB: Time (s): cpu = 00:00:00.27 ; elapsed = 00:00:00.07 . Memory (MB): peak = 3187.266 ; gain = 0.000 ; free physical = 4707 ; free virtual = 7497
Wrote PulsedLatchDB: Time (s): cpu = 00:00:00 ; elapsed = 00:00:00 . Memory (MB): peak = 3187.266 ; gain = 0.000 ; free physical = 4707 ; free virtual = 7497
Writing XDEF routing.
Writing XDEF routing logical nets.
Writing XDEF routing special nets.
Wrote RouteStorage: Time (s): cpu = 00:00:00.06 ; elapsed = 00:00:00.02 . Memory (MB): peak = 3187.266 ; gain = 0.000 ; free physical = 4707 ; free virtual = 7498
Wrote Netlist Cache: Time (s): cpu = 00:00:00.01 ; elapsed = 00:00:00.01 . Memory (MB): peak = 3187.266 ; gain = 0.000 ; free physical = 4707 ; free virtual = 7498
Wrote Device Cache: Time (s): cpu = 00:00:00.02 ; elapsed = 00:00:00 . Memory (MB): peak = 3187.266 ; gain = 0.000 ; free physical = 4707 ; free virtual = 7499
Write Physdb Complete: Time (s): cpu = 00:00:00.38 ; elapsed = 00:00:00.1 . Memory (MB): peak = 3187.266 ; gain = 0.000 ; free physical = 4707 ; free virtual = 7499
INFO: [Common 17-1381] The checkpoint '/home/rickg/Desktop/AXISearch/pwm_ip_demo/pwm_ip_demo.runs/impl_1/design_1_wrapper_physopt.dcp' has been generated.
Command: route_design
Attempting to get a license for feature 'Implementation' and/or device 'xc7z020'
INFO: [Common 17-349] Got license for feature 'Implementation' and/or device 'xc7z020'


Starting Routing Task
INFO: [Route 35-254] Multithreading enabled for route_design using a maximum of 8 CPUs

Phase 1 Build RT Design
Checksum: PlaceDB: 8eb80c82 ConstDB: 0 ShapeSum: cb07dc9e RouteDB: 15f972f0
Post Restoration Checksum: NetGraph: 6bc0c555 | NumContArr: 92cd211d | Constraints: c2a8fa9d | Timing: c2a8fa9d
Phase 1 Build RT Design | Checksum: 283dfdbac

Time (s): cpu = 00:00:14 ; elapsed = 00:00:11 . Memory (MB): peak = 3187.266 ; gain = 0.000 ; free physical = 4601 ; free virtual = 7390

Phase 2 Router Initialization

Phase 2.1 Fix Topology Constraints
Phase 2.1 Fix Topology Constraints | Checksum: 283dfdbac

Time (s): cpu = 00:00:14 ; elapsed = 00:00:11 . Memory (MB): peak = 3187.266 ; gain = 0.000 ; free physical = 4601 ; free virtual = 7390

Phase 2.2 Pre Route Cleanup
Phase 2.2 Pre Route Cleanup | Checksum: 283dfdbac

Time (s): cpu = 00:00:14 ; elapsed = 00:00:11 . Memory (MB): peak = 3187.266 ; gain = 0.000 ; free physical = 4601 ; free virtual = 7390
 Number of Nodes with overlaps = 0

Phase 2.3 Update Timing
Phase 2.3 Update Timing | Checksum: 1c9837874

Time (s): cpu = 00:00:15 ; elapsed = 00:00:12 . Memory (MB): peak = 3187.266 ; gain = 0.000 ; free physical = 4570 ; free virtual = 7359
INFO: [Route 35-416] Intermediate Timing Summary | WNS=2.859  | TNS=0.000  | WHS=-0.226 | THS=-87.750|


Phase 2.4 Soft Constraint Pins - Fast Budgeting
Phase 2.4 Soft Constraint Pins - Fast Budgeting | Checksum: 27456d508

Time (s): cpu = 00:00:16 ; elapsed = 00:00:12 . Memory (MB): peak = 3191.348 ; gain = 4.082 ; free physical = 4562 ; free virtual = 7351

Router Utilization Summary
  Global Vertical Routing Utilization    = 0.00227814 %
  Global Horizontal Routing Utilization  = 0.00211291 %
  Routable Net Status*
  *Does not include unroutable nets such as driverless and loadless.
  Run report_route_status for detailed report.
  Number of Failed Nets               = 2603
    (Failed Nets is the sum of unrouted and partially routed nets)
  Number of Unrouted Nets             = 2602
  Number of Partially Routed Nets     = 1
  Number of Node Overlaps             = 0

Phase 2 Router Initialization | Checksum: 2616a5679

Time (s): cpu = 00:00:16 ; elapsed = 00:00:12 . Memory (MB): peak = 3191.348 ; gain = 4.082 ; free physical = 4562 ; free virtual = 7351

Phase 3 Global Routing
Phase 3 Global Routing | Checksum: 2616a5679

Time (s): cpu = 00:00:16 ; elapsed = 00:00:12 . Memory (MB): peak = 3191.348 ; gain = 4.082 ; free physical = 4562 ; free virtual = 7351

Phase 4 Initial Routing

Phase 4.1 Initial Net Routing Pass
Phase 4.1 Initial Net Routing Pass | Checksum: 2d9186e2a

Time (s): cpu = 00:00:17 ; elapsed = 00:00:12 . Memory (MB): peak = 3191.348 ; gain = 4.082 ; free physical = 4564 ; free virtual = 7352
Phase 4 Initial Routing | Checksum: 2d9186e2a

Time (s): cpu = 00:00:17 ; elapsed = 00:00:12 . Memory (MB): peak = 3191.348 ; gain = 4.082 ; free physical = 4564 ; free virtual = 7352

Phase 5 Rip-up And Reroute

Phase 5.1 Global Iteration 0
 Number of Nodes with overlaps = 308
 Number of Nodes with overlaps = 20
 Number of Nodes with overlaps = 2
 Number of Nodes with overlaps = 0
INFO: [Route 35-416] Intermediate Timing Summary | WNS=2.618  | TNS=0.000  | WHS=N/A    | THS=N/A    |

Phase 5.1 Global Iteration 0 | Checksum: 213160ba7

Time (s): cpu = 00:00:18 ; elapsed = 00:00:13 . Memory (MB): peak = 3191.348 ; gain = 4.082 ; free physical = 4564 ; free virtual = 7353
Phase 5 Rip-up And Reroute | Checksum: 213160ba7

Time (s): cpu = 00:00:18 ; elapsed = 00:00:13 . Memory (MB): peak = 3191.348 ; gain = 4.082 ; free physical = 4564 ; free virtual = 7353

Phase 6 Delay and Skew Optimization

Phase 6.1 Delay CleanUp

Phase 6.1.1 Update Timing
Phase 6.1.1 Update Timing | Checksum: 25571773b

Time (s): cpu = 00:00:18 ; elapsed = 00:00:13 . Memory (MB): peak = 3191.348 ; gain = 4.082 ; free physical = 4564 ; free virtual = 7353
INFO: [Route 35-416] Intermediate Timing Summary | WNS=2.733  | TNS=0.000  | WHS=N/A    | THS=N/A    |

Phase 6.1 Delay CleanUp | Checksum: 25571773b

Time (s): cpu = 00:00:18 ; elapsed = 00:00:13 . Memory (MB): peak = 3191.348 ; gain = 4.082 ; free physical = 4564 ; free virtual = 7353

Phase 6.2 Clock Skew Optimization
Phase 6.2 Clock Skew Optimization | Checksum: 25571773b

Time (s): cpu = 00:00:18 ; elapsed = 00:00:13 . Memory (MB): peak = 3191.348 ; gain = 4.082 ; free physical = 4564 ; free virtual = 7353
Phase 6 Delay and Skew Optimization | Checksum: 25571773b

Time (s): cpu = 00:00:18 ; elapsed = 00:00:13 . Memory (MB): peak = 3191.348 ; gain = 4.082 ; free physical = 4564 ; free virtual = 7353

Phase 7 Post Hold Fix

Phase 7.1 Hold Fix Iter
INFO: [Route 35-416] Intermediate Timing Summary | WNS=2.733  | TNS=0.000  | WHS=0.030  | THS=0.000  |

Phase 7.1 Hold Fix Iter | Checksum: 2b21d2078

Time (s): cpu = 00:00:19 ; elapsed = 00:00:13 . Memory (MB): peak = 3191.348 ; gain = 4.082 ; free physical = 4564 ; free virtual = 7353
Phase 7 Post Hold Fix | Checksum: 2b21d2078

Time (s): cpu = 00:00:19 ; elapsed = 00:00:13 . Memory (MB): peak = 3191.348 ; gain = 4.082 ; free physical = 4564 ; free virtual = 7353

Phase 8 Route finalize

Router Utilization Summary
  Global Vertical Routing Utilization    = 0.538677 %
  Global Horizontal Routing Utilization  = 0.75169 %
  Routable Net Status*
  *Does not include unroutable nets such as driverless and loadless.
  Run report_route_status for detailed report.
  Number of Failed Nets               = 0
    (Failed Nets is the sum of unrouted and partially routed nets)
  Number of Unrouted Nets             = 0
  Number of Partially Routed Nets     = 0
  Number of Node Overlaps             = 0

Phase 8 Route finalize | Checksum: 2b21d2078

Time (s): cpu = 00:00:19 ; elapsed = 00:00:13 . Memory (MB): peak = 3191.348 ; gain = 4.082 ; free physical = 4564 ; free virtual = 7353

Phase 9 Verifying routed nets

 Verification completed successfully
Phase 9 Verifying routed nets | Checksum: 2b21d2078

Time (s): cpu = 00:00:19 ; elapsed = 00:00:13 . Memory (MB): peak = 3191.348 ; gain = 4.082 ; free physical = 4564 ; free virtual = 7353

Phase 10 Depositing Routes
Phase 10 Depositing Routes | Checksum: 2189b69a6

Time (s): cpu = 00:00:19 ; elapsed = 00:00:13 . Memory (MB): peak = 3191.348 ; gain = 4.082 ; free physical = 4564 ; free virtual = 7353

Phase 11 Post Process Routing
Phase 11 Post Process Routing | Checksum: 2189b69a6

Time (s): cpu = 00:00:19 ; elapsed = 00:00:13 . Memory (MB): peak = 3191.348 ; gain = 4.082 ; free physical = 4564 ; free virtual = 7353

Phase 12 Post Router Timing
INFO: [Route 35-57] Estimated Timing Summary | WNS=2.733  | TNS=0.000  | WHS=0.030  | THS=0.000  |

INFO: [Route 35-327] The final timing numbers are based on the router estimated timing analysis. For a complete and accurate timing signoff, please run report_timing_summary.
Phase 12 Post Router Timing | Checksum: 2189b69a6

Time (s): cpu = 00:00:19 ; elapsed = 00:00:13 . Memory (MB): peak = 3191.348 ; gain = 4.082 ; free physical = 4564 ; free virtual = 7353
Total Elapsed time in route_design: 12.95 secs

Phase 13 Post-Route Event Processing
Phase 13 Post-Route Event Processing | Checksum: 1827bc19a

Time (s): cpu = 00:00:19 ; elapsed = 00:00:13 . Memory (MB): peak = 3191.348 ; gain = 4.082 ; free physical = 4564 ; free virtual = 7353
INFO: [Route 35-16] Router Completed Successfully
Ending Routing Task | Checksum: 1827bc19a

Time (s): cpu = 00:00:19 ; elapsed = 00:00:13 . Memory (MB): peak = 3191.348 ; gain = 4.082 ; free physical = 4564 ; free virtual = 7353

Routing Is Done.
INFO: [Common 17-83] Releasing license: Implementation
119 Infos, 24 Warnings, 0 Critical Warnings and 0 Errors encountered.
route_design completed successfully
route_design: Time (s): cpu = 00:00:19 ; elapsed = 00:00:13 . Memory (MB): peak = 3191.348 ; gain = 4.082 ; free physical = 4564 ; free virtual = 7353
INFO: [Vivado 12-24828] Executing command : report_drc -file design_1_wrapper_drc_routed.rpt -pb design_1_wrapper_drc_routed.pb -rpx design_1_wrapper_drc_routed.rpx
Command: report_drc -file design_1_wrapper_drc_routed.rpt -pb design_1_wrapper_drc_routed.pb -rpx design_1_wrapper_drc_routed.rpx
INFO: [IP_Flow 19-1839] IP Catalog is up to date.
INFO: [DRC 23-27] Running DRC with 8 threads
INFO: [Vivado_Tcl 2-168] The results of DRC are in file /home/rickg/Desktop/AXISearch/pwm_ip_demo/pwm_ip_demo.runs/impl_1/design_1_wrapper_drc_routed.rpt.
report_drc completed successfully
INFO: [Vivado 12-24828] Executing command : report_methodology -file design_1_wrapper_methodology_drc_routed.rpt -pb design_1_wrapper_methodology_drc_routed.pb -rpx design_1_wrapper_methodology_drc_routed.rpx
Command: report_methodology -file design_1_wrapper_methodology_drc_routed.rpt -pb design_1_wrapper_methodology_drc_routed.pb -rpx design_1_wrapper_methodology_drc_routed.rpx
INFO: [Timing 38-35] Done setting XDC timing constraints.
INFO: [DRC 23-133] Running Methodology with 8 threads
INFO: [Vivado_Tcl 2-1520] The results of Report Methodology are in file /home/rickg/Desktop/AXISearch/pwm_ip_demo/pwm_ip_demo.runs/impl_1/design_1_wrapper_methodology_drc_routed.rpt.
report_methodology completed successfully
INFO: [Vivado 12-24828] Executing command : report_timing_summary -max_paths 10 -routable_nets -report_unconstrained -file design_1_wrapper_timing_summary_routed.rpt -pb design_1_wrapper_timing_summary_routed.pb -rpx design_1_wrapper_timing_summary_routed.rpx -warn_on_violation 
INFO: [Timing 38-35] Done setting XDC timing constraints.
INFO: [Timing 38-91] UpdateTimingParams: Speed grade: -1, Delay Type: min_max.
INFO: [Timing 38-191] Multithreading enabled for timing update using a maximum of 8 CPUs
INFO: [Vivado 12-24838] Running report commands "report_bus_skew, report_incremental_reuse, report_route_status" in parallel.
Running report generation with 3 threads.
INFO: [Vivado 12-24828] Executing command : report_incremental_reuse -file design_1_wrapper_incremental_reuse_routed.rpt
INFO: [Vivado_Tcl 4-1062] Incremental flow is disabled. No incremental reuse Info to report.
INFO: [Vivado 12-24828] Executing command : report_route_status -file design_1_wrapper_route_status.rpt -pb design_1_wrapper_route_status.pb
INFO: [Vivado 12-24828] Executing command : report_bus_skew -warn_on_violation -file design_1_wrapper_bus_skew_routed.rpt -pb design_1_wrapper_bus_skew_routed.pb -rpx design_1_wrapper_bus_skew_routed.rpx
INFO: [Timing 38-91] UpdateTimingParams: Speed grade: -1, Delay Type: min_max.
INFO: [Timing 38-191] Multithreading enabled for timing update using a maximum of 8 CPUs
INFO: [Vivado 12-24828] Executing command : report_power -file design_1_wrapper_power_routed.rpt -pb design_1_wrapper_power_summary_routed.pb -rpx design_1_wrapper_power_routed.rpx
Command: report_power -file design_1_wrapper_power_routed.rpt -pb design_1_wrapper_power_summary_routed.pb -rpx design_1_wrapper_power_routed.rpx
Running Vector-less Activity Propagation...

Finished Running Vector-less Activity Propagation
WARNING: [Power 33-332] Found switching activity that implies high-fanout reset nets being asserted for excessive periods of time which may result in inaccurate power analysis.
Resolution: To review and fix problems, please run Power Constraints Advisor in the GUI from Tools > Power Constraints Advisor or run report_power with the -advisory option to generate a text report.
139 Infos, 25 Warnings, 0 Critical Warnings and 0 Errors encountered.
report_power completed successfully
INFO: [Vivado 12-24828] Executing command : report_clock_utilization -file design_1_wrapper_clock_utilization_routed.rpt
INFO: [Timing 38-480] Writing timing data to binary archive.
Write ShapeDB Complete: Time (s): cpu = 00:00:00.02 ; elapsed = 00:00:00.01 . Memory (MB): peak = 3335.047 ; gain = 0.000 ; free physical = 4457 ; free virtual = 7253
Wrote PlaceDB: Time (s): cpu = 00:00:00.25 ; elapsed = 00:00:00.07 . Memory (MB): peak = 3335.047 ; gain = 0.000 ; free physical = 4456 ; free virtual = 7254
Wrote PulsedLatchDB: Time (s): cpu = 00:00:00 ; elapsed = 00:00:00 . Memory (MB): peak = 3335.047 ; gain = 0.000 ; free physical = 4456 ; free virtual = 7254
Writing XDEF routing.
Writing XDEF routing logical nets.
Writing XDEF routing special nets.
Wrote RouteStorage: Time (s): cpu = 00:00:00.11 ; elapsed = 00:00:00.03 . Memory (MB): peak = 3335.047 ; gain = 0.000 ; free physical = 4456 ; free virtual = 7254
Wrote Netlist Cache: Time (s): cpu = 00:00:00.01 ; elapsed = 00:00:00 . Memory (MB): peak = 3335.047 ; gain = 0.000 ; free physical = 4455 ; free virtual = 7255
Wrote Device Cache: Time (s): cpu = 00:00:00.02 ; elapsed = 00:00:00.01 . Memory (MB): peak = 3335.047 ; gain = 0.000 ; free physical = 4455 ; free virtual = 7255
Write Physdb Complete: Time (s): cpu = 00:00:00.4 ; elapsed = 00:00:00.11 . Memory (MB): peak = 3335.047 ; gain = 0.000 ; free physical = 4455 ; free virtual = 7255
INFO: [Common 17-1381] The checkpoint '/home/rickg/Desktop/AXISearch/pwm_ip_demo/pwm_ip_demo.runs/impl_1/design_1_wrapper_routed.dcp' has been generated.
Command: write_bitstream -force design_1_wrapper.bit
Attempting to get a license for feature 'Implementation' and/or device 'xc7z020'
INFO: [Common 17-349] Got license for feature 'Implementation' and/or device 'xc7z020'
Running DRC as a precondition to command write_bitstream
INFO: [IP_Flow 19-1839] IP Catalog is up to date.
INFO: [DRC 23-27] Running DRC with 8 threads
INFO: [Vivado 12-3199] DRC finished with 0 Errors
INFO: [Vivado 12-3200] Please refer to the DRC report (report_drc) for more information.
INFO: [Designutils 20-2272] Running write_bitstream with 8 threads.
Loading data files...
Loading site data...
Loading route data...
Processing options...
Creating bitmap...
Creating bitstream...
Writing bitstream ./design_1_wrapper.bit...
INFO: [Vivado 12-1842] Bitgen Completed Successfully.
INFO: [Project 1-1876] WebTalk data collection is mandatory when using a ULT device. To see the specific WebTalk data collected for your design, open the usage_statistics_webtalk.html or usage_statistics_webtalk.xml file in the implementation directory.
INFO: [Common 17-83] Releasing license: Implementation
151 Infos, 25 Warnings, 0 Critical Warnings and 0 Errors encountered.
write_bitstream completed successfully
write_bitstream: Time (s): cpu = 00:00:12 ; elapsed = 00:00:08 . Memory (MB): peak = 3596.582 ; gain = 189.500 ; free physical = 4107 ; free virtual = 6915
INFO: [Common 17-206] Exiting Vivado at Wed Jan 28 14:46:04 2026...

*** Running vivado
    with args -log design_1_wrapper.vdi -applog -m64 -product Vivado -messageDb vivado.pb -mode batch -source design_1_wrapper.tcl -notrace


****** Vivado v2025.1 (64-bit)
  **** SW Build 6140274 on Wed May 21 22:58:25 MDT 2025
  **** IP Build 6138677 on Thu May 22 03:10:11 MDT 2025
  **** SharedData Build 6139179 on Tue May 20 17:58:58 MDT 2025
  **** Start of session at: Wed Jan 28 15:14:29 2026
    ** Copyright 1986-2022 Xilinx, Inc. All Rights Reserved.
    ** Copyright 2022-2025 Advanced Micro Devices, Inc. All Rights Reserved.

source design_1_wrapper.tcl -notrace
Command: open_checkpoint design_1_wrapper_routed.dcp
INFO: [Device 21-403] Loading part xc7z020clg400-1
Netlist sorting complete. Time (s): cpu = 00:00:00.06 ; elapsed = 00:00:00.05 . Memory (MB): peak = 1708.371 ; gain = 0.000 ; free physical = 3033 ; free virtual = 6939
INFO: [Netlist 29-17] Analyzing 262 Unisim elements for replacement
INFO: [Netlist 29-28] Unisim Transformation completed in 0 CPU seconds
INFO: [Project 1-479] Netlist was created with Vivado 2025.1
INFO: [Project 1-570] Preparing netlist for logic optimization
Read ShapeDB Complete: Time (s): cpu = 00:00:00.01 ; elapsed = 00:00:00 . Memory (MB): peak = 1799.090 ; gain = 1.000 ; free physical = 2926 ; free virtual = 6832
INFO: [Timing 38-478] Restoring timing data from binary archive.
INFO: [Timing 38-479] Binary timing data restore complete.
INFO: [Project 1-856] Restoring constraints from binary archive.
INFO: [Project 1-853] Binary constraint restore complete.
INFO: [Designutils 20-5722] Start Reading Physical Databases.
Reading placement.
Read Netlist Cache: Time (s): cpu = 00:00:00 ; elapsed = 00:00:00 . Memory (MB): peak = 2382.941 ; gain = 0.000 ; free physical = 2401 ; free virtual = 6307
Reading placer database...
Read Device Cache: Time (s): cpu = 00:00:00.01 ; elapsed = 00:00:00.01 . Memory (MB): peak = 2382.941 ; gain = 0.000 ; free physical = 2401 ; free virtual = 6307
Read PlaceDB: Time (s): cpu = 00:00:00.05 ; elapsed = 00:00:00.05 . Memory (MB): peak = 2382.941 ; gain = 0.000 ; free physical = 2401 ; free virtual = 6307
Read PulsedLatchDB: Time (s): cpu = 00:00:00 ; elapsed = 00:00:00 . Memory (MB): peak = 2382.941 ; gain = 0.000 ; free physical = 2401 ; free virtual = 6307
Reading routing.
Read RouteStorage: Time (s): cpu = 00:00:00.03 ; elapsed = 00:00:00.01 . Memory (MB): peak = 2382.941 ; gain = 0.000 ; free physical = 2401 ; free virtual = 6307
Read Physdb Files: Time (s): cpu = 00:00:00.09 ; elapsed = 00:00:00.07 . Memory (MB): peak = 2382.941 ; gain = 0.000 ; free physical = 2401 ; free virtual = 6307
Restored from archive | CPU: 0.110000 secs | Memory: 4.520317 MB |
Finished XDEF File Restore: Time (s): cpu = 00:00:00.11 ; elapsed = 00:00:00.1 . Memory (MB): peak = 2382.941 ; gain = 3.969 ; free physical = 2401 ; free virtual = 6307
Netlist sorting complete. Time (s): cpu = 00:00:00 ; elapsed = 00:00:00 . Memory (MB): peak = 2382.941 ; gain = 0.000 ; free physical = 2401 ; free virtual = 6307
INFO: [Project 1-111] Unisim Transformation Summary:
  A total of 96 instances were transformed.
  LUT6_2 => LUT6_2 (LUT5, LUT6): 79 instances
  RAM32M => RAM32M (RAMD32(x6), RAMS32(x2)): 16 instances
  SRLC16E => SRL16E: 1 instance 

INFO: [Project 1-604] Checkpoint was created with Vivado v2025.1 (64-bit) build 6140274
WARNING: [Vivado 12-23575] Critical violations of the methodology design rules detected. Critical violations may contribute to timing failures or cause functional issues in hardware. Run report_methodology for more information.
open_checkpoint: Time (s): cpu = 00:00:12 ; elapsed = 00:00:08 . Memory (MB): peak = 2382.977 ; gain = 886.398 ; free physical = 2401 ; free virtual = 6307
Command: write_bitstream -force design_1_wrapper.bit
Attempting to get a license for feature 'Implementation' and/or device 'xc7z020'
INFO: [Common 17-349] Got license for feature 'Implementation' and/or device 'xc7z020'
Running DRC as a precondition to command write_bitstream
INFO: [IP_Flow 19-234] Refreshing IP repositories
INFO: [IP_Flow 19-1704] No user IP repositories specified
INFO: [IP_Flow 19-2313] Loaded Vivado IP repository '/tools/Xilinx/2025.1/Vivado/data/ip'.
INFO: [DRC 23-27] Running DRC with 8 threads
INFO: [Vivado 12-3199] DRC finished with 0 Errors
INFO: [Vivado 12-3200] Please refer to the DRC report (report_drc) for more information.
INFO: [Designutils 20-2272] Running write_bitstream with 8 threads.
Loading data files...
Loading site data...
Loading route data...
Processing options...
Creating bitmap...
Creating bitstream...
Writing bitstream ./design_1_wrapper.bit...
INFO: [Vivado 12-1842] Bitgen Completed Successfully.
INFO: [Project 1-1876] WebTalk data collection is mandatory when using a ULT device. To see the specific WebTalk data collected for your design, open the usage_statistics_webtalk.html or usage_statistics_webtalk.xml file in the implementation directory.
INFO: [Common 17-83] Releasing license: Implementation
23 Infos, 1 Warnings, 0 Critical Warnings and 0 Errors encountered.
write_bitstream completed successfully
write_bitstream: Time (s): cpu = 00:00:11 ; elapsed = 00:00:06 . Memory (MB): peak = 2878.074 ; gain = 495.098 ; free physical = 1880 ; free virtual = 5790
INFO: [Common 17-206] Exiting Vivado at Wed Jan 28 15:14:45 2026...
